{"generated_at":"2026-10-22T22:44:17Z","schema_version":1,"collected_at":"2026-09-02T20:33:07Z","allowlist_sha1":"92a9b9ab76590f23d670ada6e8f1e5e6527b5b9f","sigma_allowlist_sha1":"7f49db3c60c065fa7b192b035cd7bdc2f38d1c3d","rules":[{"id":"sentinel-shadow-copies-deletion-using-operating-systems-utilities","title":"Shadow Copies Deletion Using Operating Systems Utilities","kql":"SecurityEvent\n| where CommandLine contains \"shadow\" and CommandLine contains \"delete\"\n| where (NewProcessName has_any (\n  \"powershell.exe\",\n  \"wmic.exe\",\n  \"vssadmin.exe\",\n  \"vssvc.exe\"\n) or CommandLine has_any (\n  \"wmic\",\n  \"vssadmin\",\n  \"vssvc\"\n))\n| project TimeGenerated, Computer, tostring(EventID), ParentProcessName, NewProcessName, CommandLine, SubjectUserName, SourceComputerId, processID=tolong(NewProcessId), parentProcessID=tolong(ProcessId), EventData| order by TimeGenerated","techniques":["T1490"],"tables":["SecurityEvent"],"dialect":"log_analytics","source":{"kind":"sentinel","url":"https://github.com/Azure/Azure-Sentinel/blob/6af3c9df762153b8e8b7f32d0a51da1ac436e964/Solutions/Intel471/Hunting Queries/shadow-copies-deletion-using-operating-systems-utilities.yaml","license":"MIT","modified":"2026-08-27"}},{"id":"sentinel-shadow-copy-deletions","title":"Shadow Copy Deletions","kql":"let CommonRansomwareExecutionCommands = dynamic([@'vssadmin.exe delete shadows /all /quiet', \n@'wmic.exe shadowcopy delete', @'wbadmin delete catalog -quiet', \n@'Get-WmiObject Win32_Shadowcopy | ForEach-Object {$_.Delete();}',\n@'del /s /f /q c:\\*.VHD c:\\*.bac c:\\*.bak c:\\*.wbcat c:\\*.bkf c:\\Backup*.* c:\\backup*.* c:\\*.set c:\\*.win c:\\*.dsk', \n@'wbadmin delete systemstatebackup -keepVersions:0', \n@'schtasks.exe /Change /TN \"\\Microsoft\\Windows\\SystemRestore\\SR\" /disable', \n@'schtasks.exe /Change /TN \"\\Microsoft\\Windows\\SystemRestore\\SR\" /enable >nul 2>&1', \n@'reg add \"HKLM\\SOFTWARE\\Policies\\Microsoft\\Windows NT\\SystemRestore\" /v \"DisableConfig\" /t \"REG_DWORD\" /d \"1\" /f', \n@'reg add \"HKLM\\SOFTWARE\\Policies\\Microsoft\\Windows NT\\SystemRestore\" /v \"DisableSR\" /t \"REG_DWORD\" /d \"1\" /f', \n@'reg add \"HKLM\\SOFTWARE\\Microsoft\\Windows NT\\CurrentVersion\\SystemRestore\" /v \"DisableConfig\" /t \"REG_DWORD\" /d \"1\" /f', \n@'reg add \"HKLM\\SOFTWARE\\Microsoft\\Windows NT\\CurrentVersion\\SystemRestore\" /v \"DisableSR\" /t \"REG_DWORD\" /d \"1\" /f', \n@'reg delete \"HKLM\\SOFTWARE\\Policies\\Microsoft\\Windows NT\\SystemRestore\" /v \"DisableConfig\" /f >nul 2>&1', \n@'reg delete \"HKLM\\SOFTWARE\\Policies\\Microsoft\\Windows NT\\SystemRestore\" /v \"DisableSR\" /f >nul 2>&1', \n@'reg delete \"HKLM\\SOFTWARE\\Microsoft\\Windows NT\\CurrentVersion\\SystemRestore\" /v \"DisableConfig\" /f >nul 2>&1', \n@'reg delete \"HKLM\\SOFTWARE\\Microsoft\\Windows NT\\CurrentVersion\\SystemRestore\" /v \"DisableSR\" /f >nul 2>&1']);\nDeviceProcessEvents\n| where ProcessCommandLine has_any (CommonRansomwareExecutionCommands)\n| project-reorder TimeGenerated, ProcessCommandLine, DeviceName, AccountName","techniques":["T1490"],"tables":["DeviceProcessEvents"],"dialect":"log_analytics","source":{"kind":"sentinel","url":"https://github.com/Azure/Azure-Sentinel/blob/6af3c9df762153b8e8b7f32d0a51da1ac436e964/Solutions/Microsoft Defender XDR/Hunting Queries/Ransomware/ShadowCopyDeletion.yaml","license":"MIT","modified":"2024-02-22"}},{"id":"sentinel-powershell-encoded-command-execution-hunter","title":"Powershell Encoded Command Execution","kql":"SecurityEvent\n| where TimeGenerated >= ago(7d)\n| project TimeGenerated, Computer, Activity, EventID, CommandLine, NewProcessName, processId = tolong(NewProcessId), ParentProcessName, parentProcessId = tolong(ProcessId)\n| where NewProcessName endswith \"powershell.exe\"\n| where CommandLine matches regex \"-[Ee^]{1,2}[NnCcOoDdEeMmAaPpHh^`]+\\\\s+\\\"?[a-zA-Z0-9+/=]{6,}\"","techniques":["T1059.001","T1027"],"tables":["SecurityEvent"],"dialect":"log_analytics","source":{"kind":"sentinel","url":"https://github.com/Azure/Azure-Sentinel/blob/6af3c9df762153b8e8b7f32d0a51da1ac436e964/Solutions/Cyborg Security HUNTER/Hunting Queries/Powershell Encoded Command Execution.yaml","license":"MIT","modified":"2023-10-31"}},{"id":"sentinel-powershell-encoded-command-execution-intel471","title":"PowerShell Encoded Command Execution","kql":"union \n(\n    SecurityEvent\n    | project \n        TimeGenerated,\n        DeviceName=Computer,\n        EventID=tostring(EventID),\n        ParentProcessName,\n        ProcessName=NewProcessName,\n        CommandLine,\n        SubjectUserName,\n        SourceComputerId,\n        processID=tolong(NewProcessId),\n        parentProcessID=tolong(ProcessId)\n),\n(\n    DeviceEvents\n    | project\n        TimeGenerated,\n        DeviceName,\n        ProcessName=InitiatingProcessFolderPath,\n        CommandLine=ProcessCommandLine,\n        SubjectUserName=InitiatingProcessAccountName,\n        SourceComputerId=DeviceId,\n        processID=InitiatingProcessId,\n        parentProcessID=InitiatingProcessParentId,\n        ParentProcessName=InitiatingProcessParentFileName,\n        AdditionalFields,\n        EventID=ActionType\n)\n| where \n    ProcessName has_any (\n      \"powershell.exe\",\n      \"powershell_ise.exe\", \n      \"pwsh.exe\"\n      )\n| extend CommandLine_ = tostring(AdditionalFields.Command)\n| extend AllCommandLine=coalesce(CommandLine_,CommandLine)\n| where AllCommandLine matches regex \"-([Ee\\\\^]{1,2}[NnCcOoDdEeMmAaPpHh\\\\^` ]+|[Ee])\\\\s+\\\"?[a-zA-Z0-9+/=]{10,}\"\n| where not (ParentProcessName has \"Plugins\\\\Microsoft.GuestConfiguration.ConfigurationforWindows\" and ParentProcessName endswith \"gc_worker.exe\")\n| order by TimeGenerated\n| project TimeGenerated,DeviceName,EventID,ParentProcessName,ProcessName,AllCommandLine,SubjectUserName,processID,parentProcessID,SourceComputerId","techniques":["T1059.001","T1027"],"tables":["DeviceEvents","SecurityEvent"],"dialect":"log_analytics","source":{"kind":"sentinel","url":"https://github.com/Azure/Azure-Sentinel/blob/6af3c9df762153b8e8b7f32d0a51da1ac436e964/Solutions/Intel471/Hunting Queries/powershell-encoded-command-execution.yaml","license":"MIT","modified":"2026-08-27"}},{"id":"sentinel-potential-maldoc-execution-chain-observed","title":"Potential Maldoc Execution Chain Observed","kql":"let officeProducts = dynamic([\"WINWORD.EXE\",\"EXCEL.EXE\",\"POWERPNT.EXE\",\"MSACCESS.EXE\",\"VISIO.EXE\",\"WINPROJ.EXE\"]);\nlet executionMethods = dynamic([\"powershell.exe\",\"cmd.exe\",\"WScript.exe\",\"rundll32.exe\",\"cscript.exe\",\"wmic.exe\",\"mshta.exe\",\"msiexec.exe\"]);\nSecurityEvent\n| where TimeGenerated >= ago(7d)\n| where (NewProcessName has_any (officeProducts,\"OUTLOOK.EXE\",\"explorer.exe\",executionMethods) or ParentProcessName has_any (officeProducts,\"OUTLOOK\",\"explorer\",executionMethods))\n| project TimeGenerated, Computer, Activity, EventID, CommandLine, NewProcessName, processId = tolong(NewProcessId), ParentProcessName, parentProcessId = tolong(ProcessId)\n| extend sourceAppTrue=case(NewProcessName endswith \"outlook.exe\",1,\n                            (ParentProcessName has_any(\"outlook.exe\",\"explorer.exe\") and NewProcessName has_any(officeProducts)),1,\n                            0)\n| extend officeAppTrue=case(NewProcessName has_any(officeProducts),1,\n                            ParentProcessName has_any(officeProducts),1,\n                            0)\n| extend executionTrue=case(NewProcessName has_any(executionMethods),1,\n                            ParentProcessName has_any(executionMethods),1,\n                            0)\n| summarize process=make_set(NewProcessName,10), processId=make_set(processId,10), parentProcess=make_set(ParentProcessName,10),parentProcessId=make_set(parentProcessId,10), sourceApp=sum(sourceAppTrue), officeApp=sum(officeAppTrue), execution=sum(executionTrue)\nby Computer, bin(TimeGenerated,5m)\n| where sourceApp > 0 and officeApp > 0 and execution > 0","techniques":["T1059.001","T1566.001","T1218.011"],"tables":["SecurityEvent"],"dialect":"log_analytics","source":{"kind":"sentinel","url":"https://github.com/Azure/Azure-Sentinel/blob/6af3c9df762153b8e8b7f32d0a51da1ac436e964/Solutions/Cyborg Security HUNTER/Hunting Queries/Potential Maldoc Execution Chain Observed.yaml","license":"MIT","modified":"2023-10-31"}},{"id":"sentinel-meshagent-suspicious-child-process-potential-malicious-rmm-tool-usage","title":"MeshAgent Suspicious Child Process - Potential Malicious RMM Tool Usage","kql":"SecurityEvent\n| where ParentProcessName has \"meshagent.exe\" and NewProcessName has_any (\n  \"cmd.exe\",\n  \"powershell.exe\",\n  \"pwsh.exe\",\n  \"bcdedit.exe\",\n  \"schtasks.exe\"\n) or NewProcessName has \"meshagent.exe\" and CommandLine has_any (\n  \"-kvm1\",\n  \"-b64exec\"\n)\n| project TimeGenerated, Computer, tostring(EventID), ParentProcessName, NewProcessName, CommandLine, SubjectUserName, SourceComputerId, processID=tolong(NewProcessId), parentProcessID=tolong(ProcessId), EventData \n| order by TimeGenerated","techniques":["T1059.001","T1059.003","T1219"],"tables":["SecurityEvent"],"dialect":"log_analytics","source":{"kind":"sentinel","url":"https://github.com/Azure/Azure-Sentinel/blob/6af3c9df762153b8e8b7f32d0a51da1ac436e964/Solutions/Intel471/Hunting Queries/meshagent-suspicious-child-process-potential-malicious-rmm-tool-usage.yaml","license":"MIT","modified":"2026-07-14"}},{"id":"sentinel-methods-for-downloading-files-with-powershell","title":"Methods for Downloading Files with PowerShell","kql":"SecurityEvent\n| where TimeGenerated >= ago(7d)\n| project TimeGenerated, Computer, Activity, tostring(EventID), CommandLine, NewProcessName, processId = tolong(NewProcessId), ParentProcessName, parentProcessId = tolong(ProcessId), SubjectUserName, SubjectLogonId, SubjectUserSid, SourceComputerId\n| where NewProcessName has_any (\n  \"powershell.exe\",\n  \"pwsh.exe\",\n  \"powershell_ise.exe\",\n  \"pwsh-previ